{
  "$schema": "http://json-schema.org/draft-07/schema#",
  "title": "Job Offer",
  "type": "object",
  "properties": {
    "title": {
      "type": "string",
      "description": "The job title."
    },
    "description": {
      "type": "string",
      "description": "A detailed description of the job responsibilities and requirements."
    },
    "identifier": {
      "type": "object",
      "properties": {
        "name": {
          "type": "string",
          "description": "The name of the company offering the job."
        },
        "value": {
          "type": "string",
          "description": "A unique identifier for the job offer."
        },
        "siret": {
          "type": "string",
          "description": "The company's SIRET number."
        },
        "nafCode": {
          "type": "string",
          "description": "The NAF code of the company's main activity."
        }
      },
      "required": ["name", "value", "siret", "nafCode"]
    },
    "datePosted": {
      "type": "string",
      "format": "date-time",
      "description": "The date and time when the job offer was posted."
    },
    "validThrough": {
      "type": "string",
      "format": "date-time",
      "description": "The date and time until the job offer is valid."
    },
    "url": {
      "type": "string",
      "format": "uri",
      "description": "The URL of the job posting."
    },
    "applyUrl": {
      "type": "string",
      "format": "uri",
      "description": "The URL to apply for the job."
    },
    "employmentType": {
      "type": "string",
      "enum": ["FullTime", "PartTime", "Contract", "Temporary", "Internship", "Other"],
      "description": "The type of employment offered."
    },
    "employmentLevel": {
      "type": "string",
      "enum": ["none", "senior", "mid", "junior"],
      "description": "The employment level."
    },
    "hiringOrganization": {
      "type": "object",
      "properties": {
        "name": {
          "type": "string",
          "description": "The name of the hiring organization."
        },
        "sameAs": {
          "type": "string",
          "format": "uri",
          "description": "The URL of the organization's website."
        },
        "logo": {
          "type": "string",
          "format": "uri",
          "description": "The URL of the organization's logo."
        }
      },
      "required": ["name"]
    },
    "recruiter": {
      "type": "object",
      "properties": {
        "name": {
          "type": "string",
          "description": "The name of the recruiter."
        },
        "email": {
          "type": "string",
          "format": "email",
          "description": "The recruiter's email."
        },
        "phone": {
          "type": "string",
          "description": "The recruiter's phone number."
        }
      },
      "required": ["name", "email"]
    },
    "jobLocation": {
      "type": "object",
      "properties": {
        "streetAddress": {
          "type": "string",
          "description": "The street address of the job location."
        },
        "addressLocality": {
          "type": "string",
          "description": "The locality of the address."
        },
        "addressRegion": {
          "type": "string",
          "description": "The region of the address."
        },
        "postalCode": {
          "type": "string",
          "description": "The postal code of the address."
        },
        "addressCountry": {
          "type": "string",
          "description": "The country of the address."
        },
        "isoCountry": {
          "type": "string",
          "description": "The ISO2 code of the country."
        }
      },
      "required": ["streetAddress", "addressLocality", "addressRegion", "postalCode", "addressCountry", "isoCountry"]
    },
    "remoteStatus": {
      "type": "string",
      "enum": ["none", "temporary", "hybrid", "fully"],
      "description": "The remote work status of the job."
    },
    "baseSalary": {
      "type": "object",
      "properties": {
        "currency": {
          "type": "string",
          "description": "The currency of the salary, e.g., USD, EUR."
        },
        "value": {
          "type": "number",
          "description": "The amount of the salary."
        },
        "unitText": {
          "type": "string",
          "enum": ["Hour", "Day", "Week", "Month", "Year"],
          "description": "The frequency of salary payment."
        }
      },
      "required": ["currency", "value", "unitText"]
    },
    "qualifications": {
      "type": "string",
      "description": "The qualifications required for the job."
    },
    "responsibilities": {
      "type": "string",
      "description": "The responsibilities associated with the job."
    },
    "skills": {
      "type": "string",
      "description": "The skills required for the job."
    },
    "incentiveCompensation": {
      "type": "string",
      "description": "Information about additional compensation, such as bonuses."
    },
    "industry": {
      "type": "string",
      "description": "The industry of the job."
    },
    "workHours": {
      "type": "string",
      "description": "The work hours of the job."
    },
    "jobBenefits": {
      "type": "array",
      "items": {
        "type": "string"
      },
      "description": "The benefits offered by the employer."
    },
    "applicationInstructions": {
      "type": "string",
      "description": "Instructions to apply for the job."
    },
    "nonDiscriminationPolicy": {
      "type": "string",
      "description": "The employer's non-discrimination policy."
    },
    "dataProtectionPolicy": {
      "type": "string",
      "description": "Information about the data protection policy for applicants."
    }
  },
  "required": [
    "title",
    "description",
    "identifier",
    "datePosted",
    "validThrough",
    "applyUrl",
    "employmentType",
    "employmentLevel",
    "hiringOrganization",
    "recruiter",
    "jobLocation",
    "remoteStatus",
    "baseSalary",
    "nonDiscriminationPolicy",
    "dataProtectionPolicy"
  ]
}
